{
  "schema": "arena-capacity-report",
  "version": "1.0.0",
  "identity": {
    "revision": {
      "commit": "1310b68ce42e6089ccb3ec61a53629ebf93bd7ca",
      "dirty": false
    },
    "build": {
      "go_version": "go1.26.2",
      "target": "linux/amd64",
      "digest": "sha256:ca00474290e5fb5cf53b5fb3849fc0c73b08ca913fc94700dc36d3b2fa850200"
    }
  },
  "workload": {
    "name": "arena60",
    "profile": "nominal",
    "operation": "arena_game_repository_get"
  },
  "window": {
    "started_at": "2026-09-01T10:00:00Z",
    "ended_at": "2026-09-01T11:00:00Z",
    "duration_seconds": 3600
  },
  "load": {
    "participants": 16,
    "games": 8,
    "workers": 4,
    "operation_interval_ms": 250
  },
  "operations": {
    "total": 57600,
    "succeeded": 57600,
    "failed": 0,
    "correctness": {
      "checks": 57609,
      "passed": 57609,
      "failed": 0,
      "status": "PASS"
    }
  },
  "latency_ms": {
    "p50": 2,
    "p95": 5,
    "p99": 10,
    "max": 25,
    "p99_limit": 250,
    "status": "PASS"
  },
  "throughput": {
    "operations_per_second": 16,
    "minimum": 12,
    "status": "PASS"
  },
  "lag": {
    "samples": 57600,
    "p95_ms": 1,
    "max_ms": 10,
    "max_limit_ms": 2000,
    "status": "PASS"
  },
  "reconnect": {
    "attempts": 8,
    "succeeded": 8,
    "failed": 0,
    "status": "PASS"
  },
  "resources": {
    "samples": 3600,
    "goroutines": {
      "limit": 128,
      "observed_max": 24,
      "status": "PASS"
    },
    "heap_alloc_bytes": {
      "limit": 536870912,
      "observed_max": 67108864,
      "status": "PASS"
    }
  },
  "database": {
    "pool_limit": 50,
    "observed_max": 5,
    "acquired_end": 0,
    "idle_end": 5,
    "total_end": 5,
    "status": "PASS"
  },
  "thresholds": [
    {
      "metric": "failed_operations",
      "comparator": "<=",
      "limit": 0,
      "observed": 0,
      "unit": "count",
      "status": "PASS"
    },
    {
      "metric": "correctness_failures",
      "comparator": "<=",
      "limit": 0,
      "observed": 0,
      "unit": "count",
      "status": "PASS"
    },
    {
      "metric": "latency_p99",
      "comparator": "<=",
      "limit": 250,
      "observed": 10,
      "unit": "milliseconds",
      "status": "PASS"
    },
    {
      "metric": "throughput",
      "comparator": ">=",
      "limit": 12,
      "observed": 16,
      "unit": "operations_per_second",
      "status": "PASS"
    },
    {
      "metric": "scheduling_lag_max",
      "comparator": "<=",
      "limit": 2000,
      "observed": 10,
      "unit": "milliseconds",
      "status": "PASS"
    },
    {
      "metric": "reconnect_failures",
      "comparator": "<=",
      "limit": 0,
      "observed": 0,
      "unit": "count",
      "status": "PASS"
    },
    {
      "metric": "goroutines_max",
      "comparator": "<=",
      "limit": 128,
      "observed": 24,
      "unit": "count",
      "status": "PASS"
    },
    {
      "metric": "heap_alloc_bytes_max",
      "comparator": "<=",
      "limit": 536870912,
      "observed": 67108864,
      "unit": "bytes",
      "status": "PASS"
    },
    {
      "metric": "database_connections_max",
      "comparator": "<=",
      "limit": 50,
      "observed": 5,
      "unit": "count",
      "status": "PASS"
    }
  ],
  "digests": {
    "artifacts": [
      {
        "name": "arena60-report.schema.json",
        "digest": "sha256:1318ccc3ce3a6734c558237a5adbf935287a3af4873de7e14d0a872606b1e4c6"
      },
      {
        "name": "arena60-workload",
        "digest": "sha256:5073d76f5987192526a739c52d0bb34ed36e2fb5932af013ed7e46a9391450e9"
      }
    ],
    "images": [
      {
        "reference": "postgres:18-alpine",
        "digest": "sha256:b07129cc272f688c98f5b343138a0a52fa45b3d82f50d7a53ff441330624cd2e",
        "digest_scope": "content"
      }
    ]
  },
  "environment_equivalence": {
    "status": "PASS",
    "scope": "repository-and-database-major",
    "production_repository": true,
    "database_engine": "postgresql",
    "database_major": 18,
    "migration_engine": "goose",
    "container_image": "postgres:18-alpine",
    "differences": []
  }
}
